{
  "lens": "qa",
  "round": 2,
  "outcome": "approve",
  "summary": "Re-ran the suite on the new commit: the empty-slice panic is gone and the table test covers it. The nit from round 1 is still open but does not block.",
  "items": [
    {
      "id": "qa-r1-2",
      "severity": "nit",
      "category": "style",
      "title": "ok is an unhelpful name for the second return value",
      "detail": "valid or ok both work, but the doc comment calls it \"defined\", so the names disagree.",
      "file": "stats/stats.go",
      "line": 14,
      "status": "accepted"
    }
  ]
}
